{"$schema":"https://json-schema.org/draft/2020-12/schema","$id":"espresso.val001.campaign_provenance.v1","type":"object","required":["schema_version","record_id","task","status","locked_dependency","campaigns","common_provenance","artifact_bindings","claim_boundaries"],"properties":{"schema_version":{"const":"espresso.val001.campaign_provenance.v1"},"record_id":{"type":"string"},"task":{"const":"VAL-001"},"status":{"const":"PLANNING_RECORDS_ONLY"},"locked_dependency":{"type":"object"},"campaigns":{"type":"array","minItems":9,"maxItems":9,"items":{"type":"object"}},"common_provenance":{"type":"object"},"artifact_bindings":{"type":"array"},"claim_boundaries":{"type":"object"}},"additionalProperties":false}
