{
  "schema_version": "espresso.val001.campaign_provenance.v1", "record_id": "VAL001-EXP001-EXP009-PROVENANCE", "task": "VAL-001", "status": "PLANNING_RECORDS_ONLY",
  "locked_dependency": {"commit": "fc61c4670ec7bf801e40bb391aab16048b8da26b", "tree": "1d553e44ee2f7480a5df521560801b478618cc84"},
  "campaigns": [
    {"id": "EXP-001", "title": "Synchronized whole-shot telemetry and cup chemistry", "permitted_role": "Coupled hydraulics and chemistry information-gap planning", "proposed_status": "PLANNED", "evidence_level": "PLANNING_ONLY", "rights_state": "NOT_ESTABLISHED", "redistribution_state": "NOT_AUTHORIZED", "holdout_requirement": "MUST_BE_DEFINED_BEFORE_EXECUTION", "prohibited_role": "CURRENT_VALIDATION", "missing_information": "APPARATUS_PROTOCOL_UNCERTAINTY_RIGHTS_AND_DATA_IDENTITIES", "data_exist": "NOT_ESTABLISHED", "data_accessed": false, "execution_authorized": false, "commissioning_authorized": false},
    {"id": "EXP-002", "title": "Initially dry puck infiltration and physical first drip", "permitted_role": "Wetting and first-drip information-gap planning", "proposed_status": "PLANNED", "evidence_level": "PLANNING_ONLY", "rights_state": "NOT_ESTABLISHED", "redistribution_state": "NOT_AUTHORIZED", "holdout_requirement": "MUST_BE_DEFINED_BEFORE_EXECUTION", "prohibited_role": "CURRENT_VALIDATION", "missing_information": "TIMING_ORIGIN_PRESSURE_NODE_UNCERTAINTY_RIGHTS_AND_DATA_IDENTITIES", "data_exist": "NOT_ESTABLISHED", "data_accessed": false, "execution_authorized": false, "commissioning_authorized": false},
    {"id": "EXP-003", "title": "Grinder-specific particle-size, packing, and permeability map", "permitted_role": "Hydraulic-input and transfer information-gap planning", "proposed_status": "PLANNED", "evidence_level": "PLANNING_ONLY", "rights_state": "NOT_ESTABLISHED", "redistribution_state": "NOT_AUTHORIZED", "holdout_requirement": "MUST_BE_DEFINED_BEFORE_EXECUTION", "prohibited_role": "CURRENT_VALIDATION", "missing_information": "MATERIAL_PROTOCOL_UNCERTAINTY_RIGHTS_AND_DATA_IDENTITIES", "data_exist": "NOT_ESTABLISHED", "data_accessed": false, "execution_authorized": false, "commissioning_authorized": false},
    {"id": "EXP-004", "title": "Poroelastic deformation, pressure, and flow", "permitted_role": "Compaction-discrimination information-gap planning", "proposed_status": "PLANNED", "evidence_level": "PLANNING_ONLY", "rights_state": "NOT_ESTABLISHED", "redistribution_state": "NOT_AUTHORIZED", "holdout_requirement": "MUST_BE_DEFINED_BEFORE_EXECUTION", "prohibited_role": "CURRENT_VALIDATION", "missing_information": "DEFORMATION_PRESSURE_MAPPING_UNCERTAINTY_RIGHTS_AND_DATA_IDENTITIES", "data_exist": "NOT_ESTABLISHED", "data_accessed": false, "execution_authorized": false, "commissioning_authorized": false},
    {"id": "EXP-005", "title": "Time-dependent bed-mechanism discrimination (kappa(t))", "permitted_role": "Evolving-mechanism information-gap planning", "proposed_status": "PLANNED", "evidence_level": "PLANNING_ONLY", "rights_state": "NOT_ESTABLISHED", "redistribution_state": "NOT_AUTHORIZED", "holdout_requirement": "MUST_BE_DEFINED_BEFORE_EXECUTION", "prohibited_role": "CURRENT_VALIDATION", "missing_information": "MECHANISM_OBSERVABLE_PROTOCOL_UNCERTAINTY_RIGHTS_AND_DATA_IDENTITIES", "data_exist": "NOT_ESTABLISHED", "data_accessed": false, "execution_authorized": false, "commissioning_authorized": false},
    {"id": "EXP-006", "title": "Species-resolved fractional extraction", "permitted_role": "One-solute limitation and chemistry information-gap planning", "proposed_status": "PLANNED", "evidence_level": "PLANNING_ONLY", "rights_state": "NOT_ESTABLISHED", "redistribution_state": "NOT_AUTHORIZED", "holdout_requirement": "MUST_BE_DEFINED_BEFORE_EXECUTION", "prohibited_role": "CURRENT_VALIDATION", "missing_information": "SPECIES_METHOD_UNCERTAINTY_RIGHTS_AND_DATA_IDENTITIES", "data_exist": "NOT_ESTABLISHED", "data_accessed": false, "execution_authorized": false, "commissioning_authorized": false},
    {"id": "EXP-007", "title": "Spatial flow/channeling and local extraction", "permitted_role": "Spatial-maldistribution information-gap planning", "proposed_status": "PLANNED", "evidence_level": "PLANNING_ONLY", "rights_state": "NOT_ESTABLISHED", "redistribution_state": "NOT_AUTHORIZED", "holdout_requirement": "MUST_BE_DEFINED_BEFORE_EXECUTION", "prohibited_role": "CURRENT_VALIDATION", "missing_information": "SPATIAL_METHOD_UNCERTAINTY_RIGHTS_AND_DATA_IDENTITIES", "data_exist": "NOT_ESTABLISHED", "data_accessed": false, "execution_authorized": false, "commissioning_authorized": false},
    {"id": "EXP-008", "title": "Cross-machine, cross-grinder, cross-coffee replication", "permitted_role": "Transfer information-gap planning", "proposed_status": "PLANNED", "evidence_level": "PLANNING_ONLY", "rights_state": "NOT_ESTABLISHED", "redistribution_state": "NOT_AUTHORIZED", "holdout_requirement": "MUST_BE_DEFINED_BEFORE_EXECUTION", "prohibited_role": "CURRENT_VALIDATION", "missing_information": "CROSS_SYSTEM_PROTOCOL_UNCERTAINTY_RIGHTS_AND_DATA_IDENTITIES", "data_exist": "NOT_ESTABLISHED", "data_accessed": false, "execution_authorized": false, "commissioning_authorized": false},
    {"id": "EXP-009", "title": "Bottom filter-paper mechanism study", "permitted_role": "Boundary-mechanism isolation information-gap planning", "proposed_status": "PLANNED", "evidence_level": "PLANNING_ONLY", "rights_state": "NOT_ESTABLISHED", "redistribution_state": "NOT_AUTHORIZED", "holdout_requirement": "MUST_BE_DEFINED_BEFORE_EXECUTION", "prohibited_role": "CURRENT_VALIDATION", "missing_information": "FILTER_PROTOCOL_UNCERTAINTY_RIGHTS_AND_DATA_IDENTITIES", "data_exist": "NOT_ESTABLISHED", "data_accessed": false, "execution_authorized": false, "commissioning_authorized": false}
  ],
  "common_provenance": {"proposed_status": "PLANNED", "current_evidence_level": "PLANNING_ONLY", "rights_state": "NOT_ESTABLISHED", "redistribution_state": "NOT_AUTHORIZED", "holdout_requirement": "MUST_BE_DEFINED_BEFORE_ANY_FUTURE_EXECUTION", "permitted_evidence_role": "FUTURE_INFORMATION_GAP_PLANNING", "prohibited_evidence_role": "COMPLETED_EXPERIMENT_OR_CURRENT_VALIDATION", "known_missing_information": "APPARATUS_PROTOCOL_UNCERTAINTY_RIGHTS_AND_DATA_IDENTITIES", "data_exist": "NOT_ESTABLISHED", "data_accessed": false, "execution_authorized": false, "experimental_commissioning_authorized": false},
  "artifact_bindings": [], "claim_boundaries": {"experimental_commissioning": "NOT_AUTHORIZED", "holdout_execution": "NOT_AUTHORIZED"}
}
